{
  "operator_id": "exop:example:identity:1",
  "contract_version": "0.1.0",
  "implementation": {
    "language": "rust",
    "version": "0.0.0",
    "backend_tier": "native"
  },
  "family": "normalize",
  "layers": ["model"],
  "arity": {
    "inputs": {"min": 1, "max": 1},
    "outputs": {"min": 1, "max": 1}
  },
  "inputs": [
    {"name": "input", "type": "exfmt:example:value", "capabilities": []}
  ],
  "outputs": [
    {"name": "output", "type": "exfmt:example:value", "capabilities": []}
  ],
  "parameters": [],
  "preconditions": ["input.validated == true"],
  "effects": ["output.normalized == true"],
  "invariants": ["semantic:model"],
  "computability": "semantic_lossless",
  "loss": {
    "payload": {"level": "none"},
    "structure": {"level": "normalized"},
    "metadata": {"level": "none"},
    "provenance": {"level": "none"}
  },
  "algebra": {
    "deterministic": true,
    "reversible": false,
    "idempotent": true,
    "composition_rule": "Repeated application is equivalent to one application."
  },
  "execution": {
    "streaming": true,
    "seek_required": false,
    "random_access": false,
    "mmap_capable": false,
    "cost_model": {
      "time": "O(n)",
      "peak_memory": "O(1) beyond buffers",
      "bytes_written": "n"
    }
  },
  "dependencies": [],
  "security": {
    "accepts_untrusted_input": false,
    "limits": ["Replace with explicit byte, nesting, allocation, and output limits."],
    "known_risks": ["Template only; not a production operator."]
  },
  "evidence": {
    "conformance": [],
    "roundtrip": [],
    "fuzz": [],
    "benchmarks": []
  }
}

